[
  {
    "node_id": 1,
    "numerology": 1,
    "geometry": "placeholder",
    "element": "placeholder",
    "planet": "placeholder",
    "chakra": "placeholder",
    "color_ray": "placeholder",
    "sound": "placeholder",
    "tarot_card": [],
    "tara_overlay": "placeholder",
    "crystal": "placeholder",
    "symbol": "placeholder",
    "teaching_function": "placeholder",
    "related_gates": [],
    "daemon_guardian": "placeholder",
    "notes": ""
  },
  {
    "node_id": 2,
    "numerology": 2,
    "geometry": "placeholder",
    "element": "placeholder",
    "planet": "placeholder",
    "chakra": "placeholder",
    "color_ray": "placeholder",
    "sound": "placeholder",
    "tarot_card": [],
    "tara_overlay": "placeholder",
    "crystal": "placeholder",
    "symbol": "placeholder",
    "teaching_function": "placeholder",
    "related_gates": [],
    "daemon_guardian": "placeholder",
    "notes": ""
  },
  {
    "node_id": 3,
    "numerology": 3,
    "geometry": "placeholder",
    "element": "placeholder",
    "planet": "placeholder",
    "chakra": "placeholder",
    "color_ray": "placeholder",
    "sound": "placeholder",
    "tarot_card": [],
    "tara_overlay": "placeholder",
    "crystal": "placeholder",
    "symbol": "placeholder",
    "teaching_function": "placeholder",
    "related_gates": [],
    "daemon_guardian": "placeholder",
    "notes": ""
  },
  {
    "node_id": 4,
    "numerology": 4,
    "geometry": "placeholder",
    "element": "placeholder",
    "planet": "placeholder",
    "chakra": "placeholder",
    "color_ray": "placeholder",
    "sound": "placeholder",
    "tarot_card": [],
    "tara_overlay": "placeholder",
    "crystal": "placeholder",
    "symbol": "placeholder",
    "teaching_function": "placeholder",
    "related_gates": [],
    "daemon_guardian": "placeholder",
    "notes": ""
  },
  {
    "node_id": 5,
    "numerology": 5,
    "geometry": "placeholder",
    "element": "placeholder",
    "planet": "placeholder",
    "chakra": "placeholder",
    "color_ray": "placeholder",
    "sound": "placeholder",
    "tarot_card": [],
    "tara_overlay": "placeholder",
    "crystal": "placeholder",
    "symbol": "placeholder",
    "teaching_function": "placeholder",
    "related_gates": [],
    "daemon_guardian": "placeholder",
    "notes": ""
  },
  {
    "node_id": 6,
    "numerology": 6,
    "geometry": "placeholder",
    "element": "placeholder",
    "planet": "placeholder",
    "chakra": "placeholder",
    "color_ray": "placeholder",
    "sound": "placeholder",
    "tarot_card": [],
    "tara_overlay": "placeholder",
    "crystal": "placeholder",
    "symbol": "placeholder",
    "teaching_function": "placeholder",
    "related_gates": [],
    "daemon_guardian": "placeholder",
    "notes": ""
  },
  {
    "node_id": 7,
    "numerology": 7,
    "geometry": "placeholder",
    "element": "placeholder",
    "planet": "placeholder",
    "chakra": "placeholder",
    "color_ray": "placeholder",
    "sound": "placeholder",
    "tarot_card": [],
    "tara_overlay": "placeholder",
    "crystal": "placeholder",
    "symbol": "placeholder",
    "teaching_function": "placeholder",
    "related_gates": [],
    "daemon_guardian": "placeholder",
    "notes": ""
  },
  {
    "node_id": 8,
    "numerology": 8,
    "geometry": "placeholder",
    "element": "placeholder",
    "planet": "placeholder",
    "chakra": "placeholder",
    "color_ray": "placeholder",
    "sound": "placeholder",
    "tarot_card": [],
    "tara_overlay": "placeholder",
    "crystal": "placeholder",
    "symbol": "placeholder",
    "teaching_function": "placeholder",
    "related_gates": [],
    "daemon_guardian": "placeholder",
    "notes": ""
  },
  {
    "node_id": 9,
    "numerology": 9,
    "geometry": "placeholder",
    "element": "placeholder",
    "planet": "placeholder",
    "chakra": "placeholder",
    "color_ray": "placeholder",
    "sound": "placeholder",
    "tarot_card": [],
    "tara_overlay": "placeholder",
    "crystal": "placeholder",
    "symbol": "placeholder",
    "teaching_function": "placeholder",
    "related_gates": [],
    "daemon_guardian": "placeholder",
    "notes": ""
  },
  {
    "node_id": 10,
    "numerology": 1,
    "geometry": "placeholder",
    "element": "placeholder",
    "planet": "placeholder",
    "chakra": "placeholder",
    "color_ray": "placeholder",
    "sound": "placeholder",
    "tarot_card": [],
    "tara_overlay": "placeholder",
    "crystal": "placeholder",
    "symbol": "placeholder",
    "teaching_function": "placeholder",
    "related_gates": [],
    "daemon_guardian": "placeholder",
    "notes": ""
  },
  {
    "node_id": 11,
    "numerology": 2,
    "geometry": "placeholder",
    "element": "placeholder",
    "planet": "placeholder",
    "chakra": "placeholder",
    "color_ray": "placeholder",
    "sound": "placeholder",
    "tarot_card": [],
    "tara_overlay": "placeholder",
    "crystal": "placeholder",
    "symbol": "placeholder",
    "teaching_function": "placeholder",
    "related_gates": [],
    "daemon_guardian": "placeholder",
    "notes": ""
  },
  {
    "node_id": 12,
    "numerology": 3,
    "geometry": "placeholder",
    "element": "placeholder",
    "planet": "placeholder",
    "chakra": "placeholder",
    "color_ray": "placeholder",
    "sound": "placeholder",
    "tarot_card": [],
    "tara_overlay": "placeholder",
    "crystal": "placeholder",
    "symbol": "placeholder",
    "teaching_function": "placeholder",
    "related_gates": [],
    "daemon_guardian": "placeholder",
    "notes": ""
  },
  {
    "node_id": 13,
    "numerology": 4,
    "geometry": "placeholder",
    "element": "placeholder",
    "planet": "placeholder",
    "chakra": "placeholder",
    "color_ray": "placeholder",
    "sound": "placeholder",
    "tarot_card": [],
    "tara_overlay": "placeholder",
    "crystal": "placeholder",
    "symbol": "placeholder",
    "teaching_function": "placeholder",
    "related_gates": [],
    "daemon_guardian": "placeholder",
    "notes": ""
  },
  {
    "node_id": 14,
    "numerology": 5,
    "geometry": "placeholder",
    "element": "placeholder",
    "planet": "placeholder",
    "chakra": "placeholder",
    "color_ray": "placeholder",
    "sound": "placeholder",
    "tarot_card": [],
    "tara_overlay": "placeholder",
    "crystal": "placeholder",
    "symbol": "placeholder",
    "teaching_function": "placeholder",
    "related_gates": [],
    "daemon_guardian": "placeholder",
    "notes": ""
  },
  {
    "node_id": 15,
    "numerology": 6,
    "geometry": "placeholder",
    "element": "placeholder",
    "planet": "placeholder",
    "chakra": "placeholder",
    "color_ray": "placeholder",
    "sound": "placeholder",
    "tarot_card": [],
    "tara_overlay": "placeholder",
    "crystal": "placeholder",
    "symbol": "placeholder",
    "teaching_function": "placeholder",
    "related_gates": [],
    "daemon_guardian": "placeholder",
    "notes": ""
  },
  {
    "node_id": 16,
    "numerology": 7,
    "geometry": "placeholder",
    "element": "placeholder",
    "planet": "placeholder",
    "chakra": "placeholder",
    "color_ray": "placeholder",
    "sound": "placeholder",
    "tarot_card": [],
    "tara_overlay": "placeholder",
    "crystal": "placeholder",
    "symbol": "placeholder",
    "teaching_function": "placeholder",
    "related_gates": [],
    "daemon_guardian": "placeholder",
    "notes": ""
  },
  {
    "node_id": 17,
    "numerology": 8,
    "geometry": "placeholder",
    "element": "placeholder",
    "planet": "placeholder",
    "chakra": "placeholder",
    "color_ray": "placeholder",
    "sound": "placeholder",
    "tarot_card": [],
    "tara_overlay": "placeholder",
    "crystal": "placeholder",
    "symbol": "placeholder",
    "teaching_function": "placeholder",
    "related_gates": [],
    "daemon_guardian": "placeholder",
    "notes": ""
  },
  {
    "node_id": 18,
    "numerology": 9,
    "geometry": "placeholder",
    "element": "placeholder",
    "planet": "placeholder",
    "chakra": "placeholder",
    "color_ray": "placeholder",
    "sound": "placeholder",
    "tarot_card": [],
    "tara_overlay": "placeholder",
    "crystal": "placeholder",
    "symbol": "placeholder",
    "teaching_function": "placeholder",
    "related_gates": [],
    "daemon_guardian": "placeholder",
    "notes": ""
  },
  {
    "node_id": 19,
    "numerology": 1,
    "geometry": "placeholder",
    "element": "placeholder",
    "planet": "placeholder",
    "chakra": "placeholder",
    "color_ray": "placeholder",
    "sound": "placeholder",
    "tarot_card": [],
    "tara_overlay": "placeholder",
    "crystal": "placeholder",
    "symbol": "placeholder",
    "teaching_function": "placeholder",
    "related_gates": [],
    "daemon_guardian": "placeholder",
    "notes": ""
  },
  {
    "node_id": 20,
    "numerology": 2,
    "geometry": "placeholder",
    "element": "placeholder",
    "planet": "placeholder",
    "chakra": "placeholder",
    "color_ray": "placeholder",
    "sound": "placeholder",
    "tarot_card": [],
    "tara_overlay": "placeholder",
    "crystal": "placeholder",
    "symbol": "placeholder",
    "teaching_function": "placeholder",
    "related_gates": [],
    "daemon_guardian": "placeholder",
    "notes": ""
  },
  {
    "node_id": 21,
    "numerology": 3,
    "geometry": "placeholder",
    "element": "placeholder",
    "planet": "placeholder",
    "chakra": "placeholder",
    "color_ray": "placeholder",
    "sound": "placeholder",
    "tarot_card": [],
    "tara_overlay": "placeholder",
    "crystal": "placeholder",
    "symbol": "placeholder",
    "teaching_function": "placeholder",
    "related_gates": [],
    "daemon_guardian": "placeholder",
    "notes": ""
  },
  {
    "node_id": 22,
    "numerology": 4,
    "geometry": "placeholder",
    "element": "placeholder",
    "planet": "placeholder",
    "chakra": "placeholder",
    "color_ray": "placeholder",
    "sound": "placeholder",
    "tarot_card": [],
    "tara_overlay": "placeholder",